{
 "volume": "b171",
 "xmlId": "n205",
 "number": "205",
 "heading": "Fra Henrik Lund · 1. jan. 1851 · til SK",
 "sender": {
  "name": "Lund, Henrik",
  "date": {
   "raw": "18510101",
   "iso": "1851-01-01",
   "precision": "day",
   "year": 1851,
   "month": 1,
   "day": 1,
   "notBefore": null,
   "notAfter": null,
   "source": null,
   "text": null
  },
  "place": null,
  "note": null
 },
 "recipient": {
  "name": "SK",
  "date": null,
  "place": null,
  "note": null
 },
 "context": {
  "groupId": "correspContext7",
  "sameAs": "#correspContext7",
  "notes": []
 },
 "body": "n205.html"
}
