{
 "volume": "b171",
 "xmlId": "n194",
 "number": "194",
 "heading": "Fra SK · udateret [feb. 1842] · til Henriette Lund og Wilhelm Lund",
 "sender": {
  "name": "SK",
  "date": {
   "raw": "18420200",
   "iso": "1842-02",
   "precision": "month",
   "year": 1842,
   "month": 2,
   "day": null,
   "notBefore": null,
   "notAfter": null,
   "source": "supplied",
   "text": null
  },
  "place": null,
  "note": null
 },
 "recipient": {
  "name": "Lund, Henriette og Wilhelm",
  "date": null,
  "place": null,
  "note": null
 },
 "context": {
  "groupId": "correspContext5",
  "sameAs": null,
  "notes": [
   "Henriette Lund og Wilhelm Lund"
  ]
 },
 "body": "n194.html"
}
