{
 "volume": "b1",
 "xmlId": "n20",
 "number": "20",
 "heading": "Fra SK · udateret [nov. 1849] · til P.C. Kierkegaard",
 "sender": {
  "name": "SK",
  "date": {
   "raw": "18491100",
   "iso": "1849-11",
   "precision": "month",
   "year": 1849,
   "month": 11,
   "day": null,
   "notBefore": null,
   "notAfter": null,
   "source": "supplied",
   "text": null
  },
  "place": null,
  "note": null
 },
 "recipient": {
  "name": "Kierkegaard, P.C.",
  "date": null,
  "place": null,
  "note": null
 },
 "context": {
  "groupId": "correspContext1",
  "sameAs": "#correspContext1",
  "notes": []
 },
 "body": "n20.html"
}
