{
 "volume": "b208",
 "xmlId": "n223",
 "number": "223",
 "heading": "Fra SK · udateret [okt. 1849] · til Bianco Luno",
 "sender": {
  "name": "SK",
  "date": {
   "raw": "18491000",
   "iso": "1849-10",
   "precision": "month",
   "year": 1849,
   "month": 10,
   "day": null,
   "notBefore": null,
   "notAfter": null,
   "source": "supplied",
   "text": null
  },
  "place": null,
  "note": null
 },
 "recipient": {
  "name": "Luno, Bianco",
  "date": null,
  "place": null,
  "note": null
 },
 "context": {
  "groupId": "correspContext4",
  "sameAs": "#correspContext4",
  "notes": []
 },
 "body": "n223.html"
}
