{
 "volume": "b276",
 "xmlId": "n280",
 "number": "280",
 "heading": "Fra SK · udateret [aug. 1848] · til Rasmus Nielsen",
 "sender": {
  "name": "SK",
  "date": {
   "raw": "18480800",
   "iso": "1848-08",
   "precision": "month",
   "year": 1848,
   "month": 8,
   "day": null,
   "notBefore": null,
   "notAfter": null,
   "source": "supplied",
   "text": null
  },
  "place": null,
  "note": null
 },
 "recipient": {
  "name": "Nielsen, Rasmus",
  "date": null,
  "place": null,
  "note": null
 },
 "context": {
  "groupId": "correspContext1",
  "sameAs": "#correspContext1",
  "notes": []
 },
 "body": "n280.html"
}
