{
 "volume": "b308",
 "xmlId": "n314",
 "number": "314",
 "heading": "Fra S: F: · 21. maj 1851 · til SK",
 "sender": {
  "name": "S: F:",
  "date": {
   "raw": "18510521",
   "iso": "1851-05-21",
   "precision": "day",
   "year": 1851,
   "month": 5,
   "day": 21,
   "notBefore": null,
   "notAfter": null,
   "source": null,
   "text": null
  },
  "place": null,
  "note": null
 },
 "recipient": {
  "name": "SK",
  "date": null,
  "place": null,
  "note": null
 },
 "context": {
  "groupId": "correspContext4",
  "sameAs": null,
  "notes": [
   "S: F:"
  ]
 },
 "body": "n314.html"
}
