{
 "volume": "b208",
 "xmlId": "n216",
 "number": "216",
 "heading": "Fra SK · udateret [marts-april 1845] · til Israel Levin",
 "sender": {
  "name": "SK",
  "date": {
   "raw": "18450300",
   "iso": "1845-03",
   "precision": "month",
   "year": 1845,
   "month": 3,
   "day": null,
   "notBefore": null,
   "notAfter": {
    "raw": "18450400",
    "iso": "1845-04",
    "precision": "month",
    "year": 1845,
    "month": 4,
    "day": null
   },
   "source": "supplied",
   "text": null
  },
  "place": null,
  "note": null
 },
 "recipient": {
  "name": "Levin, Israel",
  "date": null,
  "place": null,
  "note": null
 },
 "context": {
  "groupId": "correspContext3",
  "sameAs": "#correspContext3",
  "notes": []
 },
 "body": "n216.html"
}
