{
 "volume": "b171",
 "xmlId": "n175",
 "number": "175",
 "heading": "Fra SK · udateret [2. juli] · til Carl Lund",
 "sender": {
  "name": "SK",
  "date": {
   "raw": null,
   "iso": null,
   "precision": null,
   "year": null,
   "month": null,
   "day": null,
   "notBefore": null,
   "notAfter": null,
   "source": "supplied",
   "text": null
  },
  "place": null,
  "note": null
 },
 "recipient": {
  "name": "Lund, Carl",
  "date": null,
  "place": null,
  "note": null
 },
 "context": {
  "groupId": "correspContext1",
  "sameAs": "#correspContext1",
  "notes": []
 },
 "body": "n175.html"
}
