{
 "volume": "b276",
 "xmlId": "n289",
 "number": "289",
 "heading": "Fra Rasmus Nielsen · 10. aug. 1849 · til SK",
 "sender": {
  "name": "Nielsen, Rasmus",
  "date": {
   "raw": "18490810",
   "iso": "1849-08-10",
   "precision": "day",
   "year": 1849,
   "month": 8,
   "day": 10,
   "notBefore": null,
   "notAfter": null,
   "source": null,
   "text": null
  },
  "place": null,
  "note": null
 },
 "recipient": {
  "name": "SK",
  "date": null,
  "place": null,
  "note": null
 },
 "context": {
  "groupId": "correspContext1",
  "sameAs": "#correspContext1",
  "notes": []
 },
 "body": "n289.html"
}
