{
 "volume": "b276",
 "xmlId": "n277",
 "number": "277",
 "heading": "Fra Rasmus Nielsen · udateret [1848] · til SK",
 "sender": {
  "name": "Nielsen, Rasmus",
  "date": {
   "raw": "18480000",
   "iso": "1848",
   "precision": "year",
   "year": 1848,
   "month": null,
   "day": null,
   "notBefore": null,
   "notAfter": null,
   "source": "supplied",
   "text": null
  },
  "place": null,
  "note": null
 },
 "recipient": {
  "name": "SK",
  "date": null,
  "place": null,
  "note": null
 },
 "context": {
  "groupId": "correspContext1",
  "sameAs": "#correspContext1",
  "notes": []
 },
 "body": "n277.html"
}
