{
 "volume": "b79",
 "xmlId": "n97",
 "number": "97",
 "heading": "Fra SK · udateret [juni 1844] · til Emil Boesen",
 "sender": {
  "name": "SK",
  "date": {
   "raw": "18440600",
   "iso": "1844-06",
   "precision": "month",
   "year": 1844,
   "month": 6,
   "day": null,
   "notBefore": null,
   "notAfter": null,
   "source": "supplied",
   "text": null
  },
  "place": null,
  "note": null
 },
 "recipient": {
  "name": "Boesen, Emil",
  "date": null,
  "place": null,
  "note": null
 },
 "context": {
  "groupId": "correspContext1",
  "sameAs": "#correspContext1",
  "notes": []
 },
 "body": "n97.html"
}
