{
 "volume": "b43",
 "xmlId": "n68",
 "number": "68",
 "heading": "Fra O.L. Bang · 25. sept. 1850 · til SK",
 "sender": {
  "name": "Bang, O.L.",
  "date": {
   "raw": "18500925",
   "iso": "1850-09-25",
   "precision": "day",
   "year": 1850,
   "month": 9,
   "day": 25,
   "notBefore": null,
   "notAfter": null,
   "source": null,
   "text": null
  },
  "place": null,
  "note": null
 },
 "recipient": {
  "name": "SK",
  "date": null,
  "place": null,
  "note": null
 },
 "context": {
  "groupId": "correspContext11",
  "sameAs": "#correspContext11",
  "notes": []
 },
 "body": "n68.html"
}
