{
 "volume": "b1",
 "xmlId": "n34",
 "number": "34",
 "heading": "Fra SK · 4. maj [1855] · til M.A. Kierkegaard",
 "sender": {
  "name": "SK",
  "date": {
   "raw": "18550504",
   "iso": "1855-05-04",
   "precision": "day",
   "year": 1855,
   "month": 5,
   "day": 4,
   "notBefore": null,
   "notAfter": null,
   "source": "suppliedYear",
   "text": null
  },
  "place": null,
  "note": null
 },
 "recipient": {
  "name": "Kierkegaard, M.A.",
  "date": null,
  "place": null,
  "note": null
 },
 "context": {
  "groupId": "correspContext5",
  "sameAs": "#correspContext5",
  "notes": []
 },
 "body": "n34.html"
}
